{
  "schema_version": "deja-vu.decision-packet/v1",
  "packet_id": "exemplar-rights-constrained-clean-room",
  "stage": "proposed",
  "problem_disposition": {
    "need_disposition": "proceed",
    "summary": "trelmitt/claude-skills' build-vs-borrow is the closest single prior-art candidate to deja-vu's own pipeline design (8-stage DETECT→…→RECORD, working sweep script, 4-verdict model, SPDX license buckets, ADR template) — but it ships with no LICENSE file, so its code cannot simply be forked or vendored no matter how good the fit is."
  },
  "candidate_comparisons": [
    {
      "candidate_id": "trelmitt-claude-skills-build-vs-borrow",
      "prior_art_kind": "skill",
      "summary": "8-stage pipeline, stdlib-only scout script (GitHub+npm+crates+OpenSSF Scorecard), 4-verdict model, SPDX license buckets, ADR template. Verified hands-on: the script runs clean, no keys required. No LICENSE file in the repository — GitHub's own license detector reports none, which under the No-LICENSE trap (references/judge.md) means all rights reserved: readable and learnable-from, not forkable or vendorable.",
      "evidence_refs": [
        "https://github.com/trelmitt/claude-skills/tree/main/build-vs-borrow",
        "gh api repos/trelmitt/claude-skills re-verified 2026-09-11: license null (no LICENSE file detected), pushed_at 2026-07-10T19:34:54Z",
        "docs/design.md §6 footnote 1",
        "references/judge.md § License, \"No-LICENSE trap\""
      ]
    }
  ],
  "uncertainty": {
    "residual": "GitHub's license detector reports null, but that is a heuristic over the repo's file tree, not a legal opinion; a LICENSE file could exist outside the paths the detector scans, or the author could grant rights on request. Neither was chased, since the fallback (clean-room reimplementation of the design, not the code) resolves the need either way.",
    "confidence": "high — the rights conclusion follows directly from a documented, mechanically-checkable absence (no LICENSE file), not from an inference about intent"
  },
  "reversibility": "high on the rights question itself (if the author later adds a LICENSE, that only widens future options; it does not retroactively legitimize what was already reimplemented clean-room) — low on unwinding the clean-room reimplementation once shipped, same as any custom-build",
  "approval_material_sha256": "2cc232d1faf754edc0c82563da32558010e32d8cf991dbfb541a3ee8dd5b74d6",
  "route_components": [
    {
      "component_id": "pipeline-stage-design",
      "route": "clean-room-reimplement",
      "output_boundary": "deja-vu's own nine-stage pipeline design (stage names, ordering, and verdict vocabulary), independently reimplemented — no source lines or literal text copied from build-vs-borrow",
      "candidate_ref": "trelmitt-claude-skills-build-vs-borrow",
      "evidence_refs": [
        "gh api repos/trelmitt/claude-skills re-verified 2026-09-11: license null",
        "docs/design.md §6 footnote 1: \"No LICENSE file — all rights reserved — and an anonymous author, so its code was not forked; its designs were treated as a reference and reimplemented\""
      ],
      "fit": "partial",
      "rights": "prohibited",
      "evidence_level": "operational",
      "custom_behavior": true,
      "custom_delta": {
        "ownership": "deja-vu maintainers",
        "maintenance_surface": "the full pipeline-stage design and its verdict vocabulary, reimplemented independently rather than derived from build-vs-borrow's source"
      },
      "policy_clauses": [
        "no source code or literal text copied from trelmitt/claude-skills; only its publicly documented pipeline stages and verdict vocabulary were used as a design reference"
      ],
      "authority": "human-required",
      "accepted_obligations": [
        "attribute the design lineage explicitly in docs/design.md §6 rather than presenting the pipeline shape as independently invented"
      ],
      "residual_uncertainty": "whether a LICENSE grant exists outside the scanned file tree, or would be given on request, is unconfirmed and was not pursued",
      "next_action": "re-check trelmitt/claude-skills for an added LICENSE file if a future decision would benefit from direct reuse rather than clean-room reimplementation; no action needed for already-shipped code"
    }
  ]
}
