{
  "schema_version": "deja-vu.decision-packet/v1",
  "packet_id": "exemplar-build-justified-no-fit",
  "stage": "proposed",
  "problem_disposition": {
    "need_disposition": "proceed",
    "summary": "A structured prior-art hunt is needed before custom code gets built: re-problem, blind-parallel multi-source sweep with snowballing, hands-on probing, context-weighted judging, an imperative gate, and a durable record/learn loop. No single found candidate covers the whole loop."
  },
  "candidate_comparisons": [
    {
      "candidate_id": "trelmitt-claude-skills-build-vs-borrow",
      "prior_art_kind": "skill",
      "summary": "The near-match: an 8-stage pipeline (DETECT→…→VERDICT→RECORD), a working stdlib-only scout script hitting GitHub+npm+crates+OpenSSF Scorecard, a 4-verdict model, SPDX license buckets, an ADR template. Verified hands-on: the script runs clean, no keys required. Covers Trigger strongly and Judge/Record partially; misses Re-problem, Snowball, Probe, and Learn entirely, and the Gate is explicitly advisory rather than imperative.",
      "evidence_refs": [
        "https://github.com/trelmitt/claude-skills/tree/main/build-vs-borrow",
        "docs/design.md §6 comparison table and footnote 1",
        "gh api repos/trelmitt/claude-skills re-verified 2026-09-11: license null (no LICENSE file), pushed_at 2026-07-10T19:34:54Z"
      ]
    },
    {
      "candidate_id": "trevors-dot-claude-github-prior-art",
      "prior_art_kind": "skill",
      "summary": "\"Search GitHub before answering\" — no verdict, no scoring. Thin coverage of Trigger and Sweep only; every other stage is unaddressed.",
      "evidence_refs": [
        "https://github.com/TrevorS/dot-claude/tree/449a215248c52106f1d13d686e4c31debe9952f5/skills/github-prior-art",
        "docs/design.md §6 comparison table and footnote 2"
      ]
    },
    {
      "candidate_id": "vercel-labs-skills",
      "prior_art_kind": "skill",
      "summary": "Mature, 31k+-star index for finding installable agent skills — solves a different problem (skill discovery, not prior-art verdicts). Not a competitor for the full loop; wired in separately as a Sweep lane (see the companion depend-skill-reuse exemplar).",
      "evidence_refs": [
        "https://github.com/vercel-labs/skills",
        "docs/design.md §6 footnote 3"
      ]
    },
    {
      "candidate_id": "runxhq-runx-prior-art",
      "prior_art_kind": "skill",
      "summary": "Broader than code (tools, protocols, governance) with confidence-tagged findings, but welded into its own host runtime and not extractable as a standalone loop.",
      "evidence_refs": [
        "https://github.com/runxhq/runx/tree/main/skills/prior-art",
        "docs/design.md §6 comparison table and footnote 4"
      ]
    },
    {
      "candidate_id": "turacthethinker-essay",
      "prior_art_kind": "research",
      "summary": "\"Stop Your AI Agent From Building Tools That Already Exist\" — a scan→score→recommend essay with a reuse/adapt/build verdict. Concept only, no implementation to adopt.",
      "evidence_refs": [
        "https://dev.to/turacthethinker/stop-your-ai-agent-from-building-tools-that-already-exist-6o9",
        "docs/design.md §6 footnote 5"
      ]
    }
  ],
  "uncertainty": {
    "residual": "five of nine stages (Re-problem, Snowball, Probe, Gate-as-imperative, Learn) had no found prior art to compare against at all, per the design.md §6 comparison table; the sweep that produced this table was not exhaustive, so a fuller-coverage skill that wasn't surfaced by the vocabularies tried cannot be ruled out.",
    "confidence": "high — the comparison table cites four real candidates plus one essay, none of which covers more than a partial subset of the nine stages, and the gap was itself the basis on which a human approved the build"
  },
  "reversibility": "low once shipped and adopted — a multi-stage skill with its own schema, scripts, and evals is not a one-line revert; this is exactly why the BUILD verdict required human gating rather than proceeding on agent authority alone",
  "approval_material_sha256": "713a0c383cdf7f8a2748c0c8686057a1c6bcbbd1d3cf0d4eb9782a5d7a23665c",
  "route_components": [
    {
      "component_id": "prior-art-hunt-loop",
      "route": "custom-build",
      "output_boundary": "the full nine-stage deja-vu skill: SKILL.md router, references/*.md per-stage detail, scripts/sweep.py + provenance.py + doctor.py, schemas/decision-packet.schema.json, and the evals/tests suite",
      "candidate_ref": null,
      "evidence_refs": [
        "docs/design.md §6 comparison table"
      ],
      "fit": "none",
      "rights": "permitted",
      "evidence_level": "operational",
      "custom_behavior": true,
      "custom_delta": {
        "ownership": "deja-vu maintainers",
        "maintenance_surface": "the entire nine-stage loop: trigger description, all reference docs, sweep/provenance/doctor scripts, decision-packet schema, and the trigger/verdict eval suite"
      },
      "policy_clauses": [],
      "authority": "human-required",
      "accepted_obligations": [
        "record this hunt's own receipts in docs/design.md §6 so a later re-hunt on \"is there already a prior-art skill\" starts from citation, not from scratch"
      ],
      "residual_uncertainty": "stages 4 (Snowball), 5 (Probe), 7 (Gate as imperative), and 9 (Learn) had no prior art to build on at all; their designs are the least externally validated parts of the shipped skill",
      "next_action": "none — shipped; re-run this hunt if a new candidate closes the identified stage gaps"
    }
  ]
}
